{
  "schema": "cli.schema.v1",
  "tool": "lmprobe",
  "version": "0.43.0",
  "policy": {
    "dryrun": true,
    "readonly": true
  },
  "inputs": [
    "flags",
    "json"
  ],
  "globals": [
    {
      "name": "dryrun",
      "type": "boolean",
      "occurs": "?",
      "description": "Simulate write operations",
      "aliases": [
        "dry-run"
      ]
    },
    {
      "name": "readonly",
      "type": "boolean",
      "occurs": "?",
      "description": "Refuse to run write operations",
      "aliases": [
        "read-only"
      ]
    },
    {
      "name": "confirm",
      "type": "boolean",
      "occurs": "?",
      "description": "Confirm dangerous operations",
      "aliases": [
        "i-understand"
      ]
    },
    {
      "name": "json",
      "type": "boolean",
      "occurs": "?",
      "description": "Output as JSON"
    },
    {
      "name": "help",
      "type": "boolean",
      "occurs": "?",
      "description": "Show help",
      "aliases": [
        "h"
      ]
    },
    {
      "name": "list",
      "type": "boolean",
      "occurs": "?",
      "description": "List operations as JSON"
    },
    {
      "name": "schema",
      "type": "boolean",
      "occurs": "?",
      "description": "Print schema document"
    },
    {
      "name": "explain",
      "type": "string",
      "occurs": "?",
      "description": "Explain an operation"
    },
    {
      "name": "input-json",
      "type": "string",
      "occurs": "?",
      "description": "JSON document input",
      "aliases": [
        "inputJson"
      ]
    },
    {
      "name": "input-graphql",
      "type": "string",
      "occurs": "?",
      "description": "GraphQL document input",
      "aliases": [
        "inputGraphql"
      ]
    },
    {
      "name": "input-file",
      "type": "string",
      "occurs": "?",
      "description": "Path to file containing JSON document input",
      "aliases": [
        "inputFile"
      ]
    }
  ],
  "operations": [
    {
      "name": "discover_projects",
      "access": "read",
      "returns": "object",
      "description": "Find project roots and nested projects",
      "params": [
        {
          "name": "tree",
          "type": "boolean",
          "occurs": "?",
          "description": "Render the parent/child project hierarchy as an indented tree (markdown only; JSON/SARIF carry the `children` field on each Project)"
        },
        {
          "name": "depth",
          "type": "number",
          "occurs": "?",
          "description": "Cap walker recursion depth"
        },
        {
          "name": "topLevelOnly",
          "type": "boolean",
          "occurs": "?",
          "description": "Emit only projects with no discovered project parent"
        },
        {
          "name": "noCache",
          "type": "boolean",
          "occurs": "?",
          "description": "Bypass history cache where supported"
        },
        {
          "name": "workspace",
          "type": "string",
          "occurs": "?",
          "description": "Read across repositories listed in a roots: YAML file; mutations refuse this mode"
        },
        {
          "name": "lang",
          "type": "string",
          "occurs": "?",
          "description": "Force the parser language; use --type to filter files by extension",
          "aliases": [
            "l"
          ]
        },
        {
          "name": "globs",
          "type": "array",
          "occurs": "*",
          "items": "string",
          "description": "Include file globs (repeatable or comma-separated; prefix ! to exclude)",
          "aliases": [
            "G"
          ]
        },
        {
          "name": "excludeGlob",
          "type": "array",
          "occurs": "*",
          "items": "string",
          "description": "Exclude file globs (repeatable or comma-separated)"
        },
        {
          "name": "noIgnore",
          "type": "boolean",
          "occurs": "?",
          "description": "Include files excluded by .gitignore and .ignore"
        },
        {
          "name": "noDefaultExcludes",
          "type": "boolean",
          "occurs": "?",
          "description": "Include dependency, build, VCS, and cache directories"
        },
        {
          "name": "threads",
          "type": "number",
          "occurs": "?",
          "description": "Worker thread count (default: num_cpus)",
          "aliases": [
            "j"
          ]
        },
        {
          "name": "limit",
          "type": "number",
          "occurs": "?",
          "description": "Cap the primary result list; composite sub-lists may need their own limit"
        },
        {
          "name": "maxFilesize",
          "type": "number",
          "occurs": "?",
          "default": 5242880,
          "description": "Skip larger files (bytes); report FILE_TOO_LARGE"
        },
        {
          "name": "ignoreCase",
          "type": "boolean",
          "occurs": "?",
          "description": "Case-insensitive matching for textual filters (grep, name)",
          "aliases": [
            "i"
          ]
        },
        {
          "name": "type",
          "type": "string",
          "occurs": "?",
          "description": "Filter files by language extension without forcing a parser",
          "aliases": [
            "t"
          ]
        },
        {
          "name": "path",
          "type": "string",
          "occurs": "?",
          "default": ".",
          "positional": true
        }
      ]
    },
    {
      "name": "search_symbols",
      "access": "read",
      "returns": "object",
      "description": "Find declarations by name, kind, or AST pattern",
      "params": [
        {
          "name": "path",
          "type": "string",
          "occurs": "?",
          "description": "Explicit search root; avoids positional query/path ambiguity"
        },
        {
          "name": "outline",
          "type": "boolean",
          "occurs": "?",
          "description": "Render the body-elided declaration outline"
        },
        {
          "name": "body",
          "type": "boolean",
          "occurs": "?",
          "description": "Return full declaration bodies"
        },
        {
          "name": "pattern",
          "type": "string",
          "occurs": "?",
          "description": "AST pattern; directories need -l, a single file can infer its language",
          "aliases": [
            "p"
          ]
        },
        {
          "name": "strictness",
          "type": "string",
          "occurs": "?",
          "enum": [
            "cst",
            "smart",
            "ast",
            "relaxed",
            "signature",
            "template"
          ],
          "description": "Match strictness for the pattern engine"
        },
        {
          "name": "name",
          "type": "string",
          "occurs": "?",
          "description": "Case-insensitive substring filter on declaration names"
        },
        {
          "name": "kind",
          "type": "string",
          "occurs": "?",
          "description": "Portable kind (function, class, struct, etc.) or parser-specific kind"
        },
        {
          "name": "rawKind",
          "type": "string",
          "occurs": "?",
          "description": "Tree-sitter literal kind — bypasses the taxonomy"
        },
        {
          "name": "has",
          "type": "string",
          "occurs": "?",
          "description": "Require a matching descendant (inline YAML rule)"
        },
        {
          "name": "inside",
          "type": "string",
          "occurs": "?",
          "description": "Require a matching ancestor (inline YAML rule)"
        },
        {
          "name": "precedes",
          "type": "string",
          "occurs": "?",
          "description": "Require a following match (inline YAML rule)"
        },
        {
          "name": "follows",
          "type": "string",
          "occurs": "?",
          "description": "Require a preceding match (inline YAML rule)"
        },
        {
          "name": "not",
          "type": "string",
          "occurs": "?",
          "description": "Exclude nodes matching this inline YAML rule"
        },
        {
          "name": "all",
          "type": "array",
          "occurs": "*",
          "items": "string",
          "description": "Require every rule (repeatable inline YAML)"
        },
        {
          "name": "any",
          "type": "array",
          "occurs": "*",
          "items": "string",
          "description": "Require at least one rule (repeatable inline YAML)"
        },
        {
          "name": "rule",
          "type": "string",
          "occurs": "?",
          "description": "YAML rule file applied as a descendant filter on candidate declarations",
          "aliases": [
            "r"
          ]
        },
        {
          "name": "hasChild",
          "type": "string",
          "occurs": "?",
          "description": "Filter by meaningful direct-child text (declarations or data structure children)"
        },
        {
          "name": "noCache",
          "type": "boolean",
          "occurs": "?",
          "description": "Bypass history cache where supported"
        },
        {
          "name": "workspace",
          "type": "string",
          "occurs": "?",
          "description": "Read across repositories listed in a roots: YAML file; mutations refuse this mode"
        },
        {
          "name": "lang",
          "type": "string",
          "occurs": "?",
          "description": "Force the parser language; use --type to filter files by extension",
          "aliases": [
            "l"
          ]
        },
        {
          "name": "globs",
          "type": "array",
          "occurs": "*",
          "items": "string",
          "description": "Include file globs (repeatable or comma-separated; prefix ! to exclude)",